{
  "schema_version": "2.0.0",
  "id": "A1",
  "version": "1.0.0",
  "release_status": "APPROVED",
  "approval_record": {
    "approval_status": "APPROVED",
    "approval_scope": "A1_CAPABILITY_CONTENT_AND_PRODUCTION_USE",
    "approved_by_role": "AI_GOVERNANCE_OWNER",
    "approved_on": "2026-08-02",
    "effective_from": "2026-08-02",
    "review_due_on": "2027-08-02",
    "release_version": "1.0.0",
    "supersedes": null,
    "authority_statement": "Approved governance knowledge for immediate production use within the defined authority boundary. Legal interpretation, evidence adjudication, finding lock, residual-risk acceptance and lifecycle authorization remain attributable human decisions.",
    "change_control": "Any semantic, state, gate, finding, source-applicability or tactic-mapping change requires a new version, dependency update, reciprocal validation and renewed approval."
  },
  "domain": "A",
  "domain_title": "Purpose, value, context, roles and classification",
  "object_type": "CAPABILITY",
  "title": "Intended purpose and use boundaries",
  "canonical_definition": "The intended purpose, users, affected persons, operating context, expected outputs, permitted uses, prohibited uses and foreseeable misuse are precise enough to govern design, implementation, evaluation, operation and change.",
  "applicability": {
    "statement": "Applicable to every AI system or AI-enabled function; assessment depth increases with autonomy, exposure, scale, affected-person impact and consequence.",
    "conditions": [
      "Assess the complete socio-technical system, not only the model.",
      "Apply to proposed use, deployed use and materially changed use.",
      "Resolve provider, deployer and internal-use perspectives where they differ."
    ],
    "exclusions": [
      "No blanket exclusion is permitted solely because the model is general-purpose, externally supplied, low-code or experimental.",
      "A component may be out of scope only when the assessed system boundary and responsibility allocation are evidenced."
    ],
    "reassessment_triggers": [
      "New user or affected-person group",
      "New decision, task or business process",
      "New data category, model, tool, integration or external effect",
      "Expansion from pilot to production or from internal to external use",
      "Material performance, risk, legal or organizational change",
      "Observed use outside the declared boundary"
    ]
  },
  "primary_questions": [
    {
      "id": "A1-Q1",
      "dimension": "DEFINITION_AND_INTENT",
      "question": "Is the intended purpose and decision context specific, bounded and testable?"
    },
    {
      "id": "A1-Q2",
      "dimension": "IMPLEMENTATION_AND_OPERATION",
      "question": "Are purpose and use boundaries implemented consistently in workflows, data use, access, tools and product behavior?"
    },
    {
      "id": "A1-Q3",
      "dimension": "EVIDENCE_AND_EFFECTIVENESS",
      "question": "Does current evidence show that actual and foreseeable use remains within the declared boundary?"
    }
  ],
  "required_evidence": [
    {
      "id": "EVD-A1-001",
      "title": "Approved purpose and use-boundary statement",
      "claim_supported": "The system has a specific, bounded and testable intended purpose, decision context and operating scope.",
      "evidence_class": "DOCUMENT",
      "minimum_technical_assurance": "DECLARED",
      "required_human_assurance": "HUMAN_VALIDATED",
      "acceptance_conditions": [
        "Identifies the business problem, intended decision or task, system boundary, operating context and target lifecycle stage.",
        "Uses the same system/version identity as the assessed implementation."
      ],
      "limitations": [
        "A statement alone does not prove implementation or effectiveness."
      ]
    },
    {
      "id": "EVD-A1-002",
      "title": "User, operator and affected-person boundary",
      "claim_supported": "Intended users, operators, affected persons and excluded audiences are explicitly identified.",
      "evidence_class": "DOCUMENT",
      "minimum_technical_assurance": "DECLARED",
      "required_human_assurance": "HUMAN_VALIDATED",
      "acceptance_conditions": [
        "Names user/operator roles and affected-person groups, including indirect or downstream exposure.",
        "Records exclusions and review triggers for new audiences."
      ],
      "limitations": [
        "Generic stakeholder lists do not establish exposure or affected-person analysis."
      ]
    },
    {
      "id": "EVD-A1-003",
      "title": "Permitted, prohibited and foreseeable-use specification",
      "claim_supported": "Permitted uses, prohibited uses and reasonably foreseeable misuse are concrete enough to guide controls and testing.",
      "evidence_class": "DOCUMENT",
      "minimum_technical_assurance": "DECLARED",
      "required_human_assurance": "HUMAN_VALIDATED",
      "acceptance_conditions": [
        "Includes examples or decision rules that distinguish permitted from prohibited use.",
        "Connects misuse scenarios to control and evaluation obligations."
      ],
      "limitations": [
        "Policy wording without system-specific conditions cannot exceed DECLARED assurance."
      ]
    },
    {
      "id": "EVD-A1-004",
      "title": "Output, outcome and decision-authority specification",
      "claim_supported": "Expected outputs, outcome expectations, decision role and non-authorized effects are measurable and bounded.",
      "evidence_class": "DOCUMENT",
      "minimum_technical_assurance": "DECLARED",
      "required_human_assurance": "HUMAN_VALIDATED",
      "acceptance_conditions": [
        "Defines output types, quality thresholds, intended downstream use and decision authority.",
        "Identifies effects that require human authorization or are prohibited."
      ],
      "limitations": [
        "Performance metrics alone do not establish appropriate decision use."
      ]
    },
    {
      "id": "EVD-A1-005",
      "title": "Implemented boundary controls",
      "claim_supported": "Workflows, interfaces, access, data routing, tools and product behavior enforce the declared purpose and use boundaries.",
      "evidence_class": "IMPLEMENTATION",
      "minimum_technical_assurance": "IMPLEMENTED",
      "required_human_assurance": "PENDING",
      "acceptance_conditions": [
        "Traceable controls exist at each material boundary, including access, data, functionality, tool/action and output use.",
        "Bypass, fallback and administrative paths are included."
      ],
      "limitations": [
        "Design diagrams or code fragments do not prove deployed enforcement."
      ]
    },
    {
      "id": "EVD-A1-006",
      "title": "Purpose-aligned evaluation results",
      "claim_supported": "Evaluation demonstrates performance, misuse resistance and boundary behavior in representative intended and foreseeable-use conditions.",
      "evidence_class": "TEST_RESULT",
      "minimum_technical_assurance": "TESTED",
      "required_human_assurance": "HUMAN_VALIDATED",
      "acceptance_conditions": [
        "Test scope traces to the declared purpose, prohibited uses, affected persons and operating conditions.",
        "Results identify system version, data, thresholds, failures and unresolved limitations."
      ],
      "limitations": [
        "A test plan or synthetic demo without executed results cannot establish TESTED assurance."
      ]
    },
    {
      "id": "EVD-A1-007",
      "title": "Operational use and drift records",
      "claim_supported": "Current operating evidence shows actual use remains within the declared boundary and material drift is detected.",
      "evidence_class": "OPERATIONAL_RECORD",
      "minimum_technical_assurance": "OPERATIONALLY_OBSERVED",
      "required_human_assurance": "HUMAN_VALIDATED",
      "acceptance_conditions": [
        "Telemetry, review records or case samples cover actual users, use cases, outputs, escalations and prohibited-use signals.",
        "The observation period and coverage are representative for the assessed operation."
      ],
      "limitations": [
        "Absence of reported incidents does not prove boundary conformance."
      ]
    },
    {
      "id": "EVD-A1-008",
      "title": "Material-change and requalification record",
      "claim_supported": "Scope expansion, new users, functions, data, integrations or effects trigger documented requalification before continued use.",
      "evidence_class": "HUMAN_DECISION",
      "minimum_technical_assurance": "IMPLEMENTED",
      "required_human_assurance": "FORMALLY_APPROVED",
      "acceptance_conditions": [
        "Decision record identifies the change, impact on intended purpose, required reassessment and authorization outcome.",
        "Unapproved expansion is prevented or constrained pending decision."
      ],
      "limitations": [
        "A backlog item or informal acknowledgement is not authorization."
      ]
    }
  ],
  "evidence_rules": {
    "evidence_ceilings": [
      "Purpose documentation can establish DECLARED intent but not implemented control or operational conformance.",
      "Implementation or configuration evidence can establish boundary controls but not their effectiveness in representative use.",
      "Executed evaluation can establish TESTED assurance only for the assessed version, scope and conditions.",
      "Operational records can establish OPERATIONALLY_OBSERVED assurance only for covered users, functions, time periods and environments."
    ],
    "false_positive_guards": [
      "Do not treat a product name, model card or marketing description as a system-specific purpose statement.",
      "Do not treat access restriction alone as evidence that permitted and prohibited uses are defined.",
      "Do not treat high model accuracy as evidence that downstream use and decision authority are appropriate.",